{"$schema":"https://json-schema.org/draft/2020-12/schema","title":"Human Outcome Reporting: report v1","type":"object","properties":{"schema_version":{"type":"string","enum":["1.0"]},"task_id":{"type":"string","pattern":"^[A-Za-z0-9][A-Za-z0-9_.:-]{0,127}$","maxLength":128},"contract_sha256":{"type":"string","pattern":"^[a-f0-9]{64}$"},"run_id":{"type":"string","pattern":"^[A-Za-z0-9][A-Za-z0-9_.:-]{0,127}$","maxLength":128},"subject_revision":{"type":"string","minLength":1,"maxLength":200},"generated_at":{"type":"string","format":"date-time","maxLength":64},"kind":{"type":"string","enum":["progress","final","blocked","handoff","answer"]},"profile":{"type":"string","enum":["auto","feature","bugfix","refactor","research","review","planning","operations","documentation","security","release","utility"]},"stage":{"type":"string","minLength":1,"maxLength":300},"outcomes":{"type":"array","items":{"type":"object","properties":{"id":{"type":"string","pattern":"^[A-Za-z0-9][A-Za-z0-9_.:-]{0,127}$","maxLength":128},"kind":{"type":"string","enum":["observed","proposal","hypothesis","limitation"]},"text":{"type":"string","minLength":1,"maxLength":8000},"impact":{"type":"string","minLength":1,"maxLength":8000},"criterion_ids":{"type":"array","items":{"type":"string","pattern":"^[A-Za-z0-9][A-Za-z0-9_.:-]{0,127}$","maxLength":128},"minItems":0,"maxItems":1000,"uniqueItems":true},"plan_step_ids":{"type":"array","items":{"type":"string","pattern":"^[A-Za-z0-9][A-Za-z0-9_.:-]{0,127}$","maxLength":128},"minItems":0,"maxItems":1000,"uniqueItems":true},"evidence_ids":{"type":"array","items":{"type":"string","pattern":"^[A-Za-z0-9][A-Za-z0-9_.:-]{0,127}$","maxLength":128},"minItems":0,"maxItems":1000,"uniqueItems":true}},"required":["id","kind","text","impact","criterion_ids","plan_step_ids","evidence_ids"],"additionalProperties":false},"minItems":0,"maxItems":1000},"checks":{"type":"array","items":{"type":"object","properties":{"id":{"type":"string","pattern":"^[A-Za-z0-9][A-Za-z0-9_.:-]{0,127}$","maxLength":128},"verification_id":{"type":"string","pattern":"^[A-Za-z0-9][A-Za-z0-9_.:-]{0,127}$","maxLength":128},"attempt":{"type":"integer","minimum":1,"maximum":10000},"status":{"type":"string","enum":["passed","failed","blocked","not_run","skipped"]},"subject_revision":{"type":"string","minLength":1,"maxLength":200},"environment":{"type":"string","minLength":1,"maxLength":200},"observed_at":{"type":"string","format":"date-time","maxLength":64},"summary":{"type":"string","minLength":1,"maxLength":8000},"evidence_ids":{"type":"array","items":{"type":"string","pattern":"^[A-Za-z0-9][A-Za-z0-9_.:-]{0,127}$","maxLength":128},"minItems":0,"maxItems":1000,"uniqueItems":true},"supersedes":{"type":"array","items":{"type":"string","pattern":"^[A-Za-z0-9][A-Za-z0-9_.:-]{0,127}$","maxLength":128},"minItems":0,"maxItems":1000,"uniqueItems":true}},"required":["id","verification_id","attempt","status","subject_revision","environment","observed_at","summary","evidence_ids","supersedes"],"additionalProperties":false},"minItems":0,"maxItems":1000},"evidence":{"type":"array","items":{"type":"object","properties":{"id":{"type":"string","pattern":"^[A-Za-z0-9][A-Za-z0-9_.:-]{0,127}$","maxLength":128},"kind":{"type":"string","enum":["execution","manual_review","inspection","artifact","research_source"]},"path":{"type":"string","minLength":1,"maxLength":2000},"sha256":{"type":"string","pattern":"^[a-f0-9]{64}$"},"run_id":{"type":"string","pattern":"^[A-Za-z0-9][A-Za-z0-9_.:-]{0,127}$","maxLength":128},"subject_revision":{"type":"string","minLength":1,"maxLength":200},"summary":{"type":"string","minLength":1,"maxLength":8000},"sensitivity":{"type":"string","enum":["internal","public"]}},"required":["id","kind","path","sha256","run_id","subject_revision","summary","sensitivity"],"additionalProperties":false},"minItems":0,"maxItems":1000},"plan_progress":{"type":"array","items":{"type":"object","properties":{"step_id":{"type":"string","pattern":"^[A-Za-z0-9][A-Za-z0-9_.:-]{0,127}$","maxLength":128},"status":{"type":"string","enum":["not_started","in_progress","done","blocked","cancelled"]},"note":{"type":"string","minLength":1,"maxLength":8000}},"required":["step_id","status","note"],"additionalProperties":false},"minItems":0,"maxItems":1000},"answers":{"type":"array","items":{"type":"object","properties":{"question_id":{"type":"string","pattern":"^[A-Za-z0-9][A-Za-z0-9_.:-]{0,127}$","maxLength":128},"status":{"type":"string","enum":["answered","unknown","not_applicable"]},"text":{"type":"string","minLength":1,"maxLength":8000}},"required":["question_id","status","text"],"additionalProperties":false},"minItems":0,"maxItems":1000},"blockers":{"type":"array","items":{"type":"object","properties":{"text":{"type":"string","minLength":1,"maxLength":8000},"impact":{"type":"string","minLength":1,"maxLength":8000},"next_action":{"type":"string","minLength":1,"maxLength":8000},"owner":{"type":"string","minLength":1,"maxLength":200}},"required":["text","impact","next_action","owner"],"additionalProperties":false},"minItems":0,"maxItems":1000},"risks":{"type":"array","items":{"type":"object","properties":{"text":{"type":"string","minLength":1,"maxLength":8000},"impact":{"type":"string","minLength":1,"maxLength":8000},"blocks_acceptance":{"type":"boolean"}},"required":["text","impact","blocks_acceptance"],"additionalProperties":false},"minItems":0,"maxItems":1000},"next_actions":{"type":"array","items":{"type":"object","properties":{"text":{"type":"string","minLength":1,"maxLength":8000},"owner":{"type":"string","minLength":1,"maxLength":200},"criterion_ids":{"type":"array","items":{"type":"string","pattern":"^[A-Za-z0-9][A-Za-z0-9_.:-]{0,127}$","maxLength":128},"minItems":0,"maxItems":1000,"uniqueItems":true}},"required":["text","owner","criterion_ids"],"additionalProperties":false},"minItems":0,"maxItems":1000},"usage":{"type":"array","items":{"type":"string","minLength":1,"maxLength":8000},"minItems":0,"maxItems":100},"delivery":{"type":"object","properties":{"state":{"type":"string","enum":["not_deployed","staging","production","not_applicable","unknown"]},"text":{"type":"string","minLength":1,"maxLength":8000},"evidence_ids":{"type":"array","items":{"type":"string","pattern":"^[A-Za-z0-9][A-Za-z0-9_.:-]{0,127}$","maxLength":128},"minItems":0,"maxItems":1000,"uniqueItems":true}},"required":["state","text","evidence_ids"],"additionalProperties":false}},"required":["schema_version","task_id","contract_sha256","run_id","subject_revision","generated_at","kind","profile","stage","outcomes","checks","evidence","plan_progress","answers","blockers","risks","next_actions","usage","delivery"],"additionalProperties":false}
