{"schema_version":"1.0","task_id":"DEMO-1","contract_sha256":"9ef12e24225aa3fa309a7f2dff0e00b8f0b0a74511e017dce61cc114a9bacfee","run_id":"example","subject_revision":"synthetic-v1","generated_at":"2026-10-02T00:00:00Z","kind":"final","profile":"feature","stage":"Проверка примера","outcomes":[{"id":"o1","kind":"observed","text":"В учебной фикстуре выгружаются заказы за выбранный период.","impact":"Владелец получает список за нужные даты.","criterion_ids":["c1"],"plan_step_ids":["s1"],"evidence_ids":["e1"]}],"checks":[{"id":"k1","verification_id":"v1","attempt":1,"status":"passed","subject_revision":"synthetic-v1","environment":"учебная фикстура","observed_at":"2026-10-02T00:00:00Z","summary":"В учебных данных границы периода соблюдены.","evidence_ids":["e1"],"supersedes":[]},{"id":"k2","verification_id":"v2","attempt":1,"status":"not_run","subject_revision":"synthetic-v1","environment":"учебная фикстура","observed_at":"2026-10-02T00:00:00Z","summary":"Проверка под пользователем другой организации не запускалась.","evidence_ids":[],"supersedes":[]}],"evidence":[{"id":"e1","kind":"manual_review","path":"evidence.txt","sha256":"db0f4b4afd8089a1b0356585d5843fcad1bfd3f99caa56ef33371751e2c9c317","run_id":"example","subject_revision":"synthetic-v1","summary":"Текстовое подтверждение из синтетического примера.","sensitivity":"public"}],"plan_progress":[{"step_id":"s1","status":"done","note":"Выгрузка и период проверены на учебных данных."},{"step_id":"s2","status":"not_started","note":"Проверка изоляции не проведена."}],"answers":[],"blockers":[],"risks":[{"text":"Изоляция данных организаций не подтверждена.","impact":"До проверки публикация может открыть доступ к чужим заказам.","blocks_acceptance":true}],"next_actions":[{"text":"Проверить выгрузку под пользователем другой организации.","owner":"Разработчик","criterion_ids":["c2"]}],"usage":[],"delivery":{"state":"not_deployed","text":"Это учебный пример; рабочий магазин не изменён.","evidence_ids":[]}}
